filename,summary,cluster
Terna.txt,"summarize: summarize: 2023 relazione finanziaria annuale 2023-2023 Executives, disposizione  corporate governance Tayshe details the strategies adopted by the various companies operating in and around the country. The report also includes detailed information on the growth of the electric vehicle industry in the U.S. From the perspective of McKinsey & Co., the green bond market will be among the largest sources of revenue for the organization. In this chapter, the Green Beret explains how the government will pay for energy efficiency projects over the next several years. It anticipates that between 2023 and 2023, there will be a significant increase in the number of people employed in this field. Ragueneau gives detailed account of the investments taking place in renewable energy technology during the forecast period. He also discusses the use of green bonds to spur innovation in energy technology. Next up for grabs is the coal-fired power plant in Tenerife, Italy",1
Banca_Monte_Paschi_Siena.txt,"summarize: In this chapter, we will delve deeper into the financial details of the largest bank in the world, montepaschi.com . In order to understand how these banks manage their money, it is necessary to know that they are investing heavily in innovative technology and that they have a strong commitment to delivering on climate change goals. The following chapters provide detailed information about the strategy for achieving these goals. Graziano reveals his plans to introduce a gender pay gap prevention campaign in 2023. He also details the financing for this campaign through a partnership between the BNP Paribas and the Bank of England as well as other sources. In addition, he explains Micronesia's role in the anti-fraud movement which focuses on tracking down and reporting frauds without fear of being labeled as anti-capitalist or anti-Semitic. This chapter also delves into the nature of the labor movement and its relationship to climate change. For example, there are many union leaders planning",3
Medio_Banca.txt,"summarize: This paper is the first of many to be presented in this edition, and it focuses on the details of the project. It also includes detailed information about how individuals are paid according to their gender, age, and other factors that may affect their earnings. The compact will need to have an adequate supply of workers who can be trained and employable by the end of the 2023/2025 year cycle. Micronesia explains how it uses technology to improve the lives of people in need of financial assistance. Micron plans to invest $1.6 billion in climate change adaptation projects over the next three years. Compass announces its intention to invest up to 3.5 billion dollars in research and development over the coming five years. In this paper, Bauer and Co. discuss employee-employee co-ordination to ensure that all employees are given a fair share of direct benefit to indirect benefit. Bauer emphasizes the importance of ""associations for responsible financial disclosures"" .",2
Eni.txt,"summarize: In this chapter, we will focus on the technical details of the Sustainable Development Goals, which are to be published in 2023. The goals include: 1) Achieving sustainable development goals; 2) Promoting energy efficiency and 3) Ensuring that all forms of industry benefit from renewable energy sources; 4) Increasing awareness of climate change; 5) Providing adequate protection for workers against harmful carbon pollution; and 6) Asserting a commitment to reduce greenhouse gas emissions during the 2023-2025 period; and 7) Implementing new emission control technology into electricity production by 2030.""Gulliver explains how he came to be able to predict the future without knowing it. He predicts that ""in 2023 there will be a dramatic increase in greenhouse gases due to climate change"" . Wolff lays out his strategy for achieving zero GHG emissions by 2023 and compares it to the Paris climate accord of 2040. It is not yet clear if Wolff",2
Italgas.txt,"summarize: Gruppo Italgas organizes a ""relazione annuale integrata 2023"" that will determine the size and composition of the organization's activities. The company plans to invest $1.6 billion in research and development over the next several years; it plans to offer a range of services and products from renewable energy to high-efficiency electric power by 2023. In this chapter, Alek explains how he plans to advance his business strategy in the face of increasing competition from China and India. He also details the technical details of each stage of the project as well as a detailed plan for financing it. Ganymede then describes the structure of the contract, which is designed to reduce costs and improve efficiency while simultaneously making it easier for companies to scale up and become more efficient.",1
Iveco_Group.txt,"In this chapter, we will discuss the growth of the industry in terms of carbon footprint and how it compares to other emerging markets. In order to address these concerns, Carbon Brief plans to publish its annual report on the world's carbon footprint by 2023. The company also plans to invest $10 billion in research and development over the next several years into a new energy technology called ""responsible trucking"" that will enable companies to reduce their carbon footprints by 40% by 2040. In this chapter, we will focus on the details of the strategy for carbon reduction in the United States and Europe. Here are some of the key takeaways from this paper: 1) Achieving a carbon footprint does not automatically equal a positive economic impact; 2) Carbon footprints do not always correspond to CO2 emissions; 3) Direct action against climate change contributes to GHG emissions; 4) Coal-fired power plants contribute less CO2 than other energy sources; 5) Waste management reduces greenhouse gas emissions by about 40% per year; 6) Renewable energy efficiency is an important driver of innovation; 7) The cost of electricity generation has declined over the past few years; 8) It is now cheaper to produce electricity rather than",2
Saipem.txt,"summarize: In this chapter, we delve deeper into the financial details of the 2023 forecast and its implications for the growth of the industry. In order to understand how the market is likely to be influenced by factors such as interest in energy efficiency, cost-effectiveness, innovation, and competition, it will need to know whether these factors are directly or indirectly influencing the business decision making process. For example, GE predicts that over half a million new jobs will be created between 2023 and 2027. The bulk of this investment will come from China, which is already well on its way to achieving zero emissions by 2030. Gulliver describes the strategy for achieving low-carbon energy efficiency in the United States and Europe. He predicts that by 2023, he expects to have achieved zero emissions from all of the major U.S. oil refineries. Lufthansa plans to invest $10 billion in research and development over the next several years into a new technology called",2
