filename,summary,cluster
ITA_Amplifon.txt,"summarize: Volger and Co. prepare to publish their annual report on ""product service stewardship"" in the next few months, which will be released in 2023. They plan to invest $1.6 billion in research and development over the next five years, as well as provide detailed information about how people are using technology to improve their lives. Holffield plans to use this information to advance his business strategy, while Co. co. leads the industry in developing new products and services that will enable him to better serve the needs of those who need it most. He is also planning to launch a new innovation hub called ""Product Service Stewardship,"" which will allow him to develop innovative solutions for delivering high-quality, value-added services directly In this paper, we will discuss the growth of women's rights in the 21st century and its impact on economic development. The report also includes detailed estimates of the gender pay gap between men and women in the United States during the",1
PIRELLI.txt,"summarize: In this chapter, the author describes how he plans to advance his business strategy in order to meet the growing demands of a rapidly changing population. He predicts that by the end of the century, people will be able to make more informed decisions about how they will live, work, and pay off their loans. Volger and Co. publish their forecast for the 2023-2025 period, which they believe will be the largest and most detailed forecast of the next five years. Pirelli publishes its annual report on passenger and freight traffic in 2023. Gulliver explains how he and his co-conspirators are able to predict the future without knowing that they will be forced to improvise or fall short of achieving their goals. The narrator also discusses Ford's plan to spend $1.6 billion on new roads, bridges, railways, and tunnels over the next decade or so. Carbon Brief provides detailed recommendations for how best to manage waste and improve efficiency during",0
Hera_Gruppo.txt,"summarize: In this chapter, we delve deeper into the details of the carbon footprint and how it will be used to drive energy efficiency in the future. Carbon footprints are a major part of the fabric of electricity generation; they are also an important aspect of climate change mitigation. In order to better understand carbon footprints, Carbon footprints must be proportionate to the amount of CO2 emitted per square mile (1.6 litre) . Ganymede explains her strategy for harnessing the power of technology in order to drive innovation and reduce costs. She plans to employ more than 1,000 people who are not technically connected to the electricity grid. The PIO is particularly interested in developing innovative ways to share information about innovations and reduce waste. This chapter focuses on the growth of the U.S. economy in the face of rising competition from China. Dr. Barlow discusses the rise of e-commerce as an alternative means of payment for goods and services such as credit card debt",2
IntesaSanpaolo.txt,"summarize: In this executive summary, Gulliver outlines how he plans to advance his business strategy in the face of increasing competition from China and other emerging markets. He predicts that by 2023, he will be able to offer a wide range of services to both domestic and foreign clients at a lower cost than previously planned. The central issue concerns climate change, which could lead to significant economic consequences for the United States as a result of its growth over the next several decades. Volger and Co. plan to launch a new technology called Carbon Calcio, which will enable them to track and analyze greenhouse gas emissions in real-time as they scale up production of the next generation of electric cars. Micronesia plans to invest $1.6 billion over the coming five years developing advanced technology to improve people's lives. Green and Carbon agree on ""the importance of circular economy to the growth of green economies in the coming years."" Dorothee explains how she came to be an",0
Banca_Popolare_di_Sondrio.txt,"summarize: In this chapter, David lays out his plans for the growth of the Banca Popolare in 2023-2025. He focuses on three areas: 1) an economic development; 2) a social safety net; and 3) a bank's ability to pay back loans that have been loaned to them; and 4) a system of checks and balances designed to ensure that lenders do not overspend or overcharge their customers. Gulliver discusses the progress of the financial reporting industry in developing countries. The report anticipates significant growth in both innovation and cost over the next several years. Volger and Co. plan to introduce a carbon tax by 2040, which he says will reduce greenhouse gas emissions by 40% by 2023. Volkswagen plans to build more than 1,000 new electric scooters in Europe by the year 2023 . Ford Motor Co., Citibank , and Ford Motor Company all plan to invest $1.6 billion in",3
Leonardo_Brochure.txt,"In this chapter, Leonardo presents his strategy for the 2023-2025 growth of the LEONARDESustainability program. He focuses on innovations that will enable companies to better manage their energy and reduce carbon footprints. In order to achieve these goals, he plans to invest $10 billion in research and development over the next five years. This investment will be significant because it will allow him to scale back some of the company's greenhouse gas emissions without compromising on quality or safety. Leonardo sustainability, action 2023 , is the first company to announce its commitment to investing in innovation and new technology in the 21st century. It anticipates spending $10 billion on research and development over the next several years, as well as a further $1.5 billion on manufacturing and logistics. Its growth will be driven by innovations in artificial intelligence, machine learning, telecommunication, information technology, and bioprocessing. In addition, it plans to invest more than $300 million in green energy projects across the U.S., Europe, and Asia during the next few years. Leonardo presents his strategy for the energy revolution in the coming years: sustainability, action 2023; maggiori informazioni consultare i leonardo com it sustainability.org ; and 'the year 2023' , which he plans to publish shortly",0
Diasorin_Bilancio.txt,"summarize: In this paper, we will discuss the technical details of the next generation of biopharmaceuticals. In order to understand how these new products will be used, it is essential that they are well-rehearsed and approved by a wide range of industry leaders in order to better understand their capabilities. The first step toward understanding the technology will be implemented in the second half of the 2023 financial year. Luminex Corporation, the world's largest manufacturer of medical devices, plans to launch a new product in 2023. The company plans to employ more than 100,000 people over the next several years as part of a strategy to drive innovation and reduce costs. Executives from all major players in the industry are expected to report on their performance during the first Half of the year.",0
Inwit.txt,"The report on climate-related financial disclosure is the first in a series of reports covering the 2023-2025 period. It focuses on the growth of innovative technology and predicts that by 2023, there will be more than 1.5 million new connected devices in the U.S. alone. The report anticipates rapid growth in this area as well as an increase in demand for electricity from renewable sources.",2
Azimut.txt,"In this short chapter, we briefly summarize the activities of Azimut Capital Management S.p.A., the world's largest publicly traded company, as well as its financial position and growth prospects. We also briefly delve into the ""Prologue"" of the company's strategy for investing in socially responsible enterprises. The company offers a range of products and services that will enable it to compete effectively with other large players in the market. For example, an electric cart can be used to carry goods from one location to another without being detected by anyone else. In addition, there are new investments in infrastructure such as roads, railways, energy efficiency devices, and so on. This is all very interesting--and perhaps even more exciting--than any MSCI ESG Research analyzes the performance of its investimenti in order to predict future growth. The company has invested more than $1.6 billion in investments in the last three years, according to estimates from industry sources. MSCI notes that this is the largest investment ever made in a single sector and predicts future growth for the rest of the S&P 500. In addition, it includes an extensive set of risk management tools designed to help companies manage their cash flow better.",0
Interpump.txt,"summarize: Dostoevsky is the co-founder and chief executive officer of Interpump Group, a trade association that represents all major players in the oil and gas industry. He will chair the organization's 2023-2023 conference and report on developments from this point forward. In addition, Dostovsky will serve as president emeritus for five years starting in 2023. The following chapters are excerpted from his report: ""Liori best practices interna lazioni finanziarie periodiche"" . This paper is a synthesis of best practices developed by several industry associations and published by Accenture. These associations provide recommendations for implementing best practices across all aspects of financial transactions. The interpump group dichiarazione  carattere  finanziario 2023 1 gruppo 2 governance 3 etica 4 sostenibilà 5 personale 6 ambiente 7 ambito socio economico 8 diritti umani 9",0
UniCredit.txt,"summarize: summarize: bilancio integrato 2023 unlocking transformation together for our clients Our people and our communities In this short chapter, the narrator outlines his vision for transforming the financial services industry from a technology perspective to one based on sustainable growth. It also describes how it plans to invest $20 billion by 2023 in developing countries with an emphasis on innovation rather than relying on traditional methods of financing. The company anticipates investing $25 billion over the next five years in projects such as finance, information technology, energy efficiency, digitalization, and green technology. The narrator gives detailed account of the financial transactions that took place between 2023 and 2023. The breakdown of these transactions is shown in the table below. He then gives detailed descriptions of some of the key developments in the field. In particular, he looks at how the performance of the banking system has changed over the last several years. With that said, let us know if you have any ideas for investing in the",2
A2A.txt,"summarize: Life is Circle In this chapter, we delve deeper into the growth of the biotechnology industry as it relates to climate change and energy efficiency. The companies will be investing heavily in renewable energy technology over the next several years, creating jobs for both workers and customers who are not yet economically literate enough to support a strong economy. Marx explains how he plans to advance his strategy on climate-related financial disclosure in the coming years. He anticipates rapid growth in energy efficiency as a result of coal-fired electricity generation from renewable sources. Tazza describes how he came to be a part of Hitachi rail, a 2A energy solutions company with a focus on improving energy efficiency and reducing carbon footprints. Gulliver describes his new product, ""Anomaly Detection Capace"" , which helps identify anomalies in real time. Next Generation 2023; Renewable Energy 2020-2025; And Other Weforum organizes an interregional conference on climate change, energy efficiency",2
MONCLER-GROUP.txt,"The moncler group, which is the largest manufacturer of textiles and apparel in the world, announces its intention to invest $10 billion in research and development over the next five years. The company plans to spend another $20 billion on new products and services during the forecast period. It also plans to launch a new line of moncler devices in 2023 that will enable it to compete with other companies in delivering high-quality, cost-effective goods. In addition, it plans to offer ""hybrid energy solutions"" -- i.e. ""alternative fuels"" -- in 100% renewable energy technology by 2025. As a result, the industry will see more demand for these products than it has seen in the past few years. To counteract this growth, the moncler groups are planning to introduce advanced manufacturing methods such as biopharmaceuticals into their product lines. They plan to employ 1,000 people across the world who will be able to benefit from this new technology.",1
Nexi.txt,"summarize: Bilancio consolidato 2023 8 This report describes the growth of the bank from the perspective of cost-effectiveness to efficiency. It also provides details of the strategy for investing in and scaling up the bank's technology, which will enable it to better compete with other big players in the industry. In addition, the bank plans to invest $10 billion in new technology over the next five years, making it the single largest bank in the world. Additionally, the report details the activities of the Gruppo nexi, which is the world's largest manufacturer of electric cars. The gruppo has agreed to spend $1.6 billion in infrastructure projects over the coming years to improve efficiency and reduce costs. Bilancios consolidato2023 163 is the largest single-serve system in the history of accounting and is the most advanced in terms of accuracy and efficiency. During the forecast period, the company plans to double its revenue by 2025 from $10.7 billion",3
Unipolsai.txt,"summarize: summarize: 2023 bilancio 'sostenibilità progetto grafico mercurio gp s r. stampa tipo litografia righi unipolsai assicurazioni 782 5 341 loss ratio 71 5 65 2-3143 loss ratio 61 565 2- 3143 netto consolidatori, disposizione sociale ambientale milioni 8 651 8 304 netto cooperatives, service providers, directors, trade unions, and industry associations will use this information to develop new ways of achieving the goals set forth by the Paris climate change accords 2022-2023. summarize: endenti n 25 149 41 424 39 teste corsi cyber security rete n 20 617 21 584 4 ore CrowdStrike predicts that 2023 will be the largest-ever tax collection year in terms of how much it costs to build and operate a new type of electric vehicle.",2
Banco_BPM.txt,"summarize: In this paper, the Bank of England lays out its forecast for the years 2023-2025. It anticipates significant growth in consumption and energy efficiency over the next few years as well as a reduction in greenhouse gas emissions. Executives from all major banks -- including Germany, France, Britain, Spain, Italy, and Japan -- will discuss how they will respond to changes in the financial system. The BNP Paribas report, sostenibilità 2023, is the most important document in this series. It includes detailed recommendations for how to improve corporate governance in the coming years aswell as details of how to best manage a growing number of new and innovative technology projects. The following year, the BPM will publish its findings on climate change and energy efficient in the United States. Next, Gildiver discusses the proposed energy efficiency plans. This chapter also focuses on some of the major developments that have taken place over the last few months.",3
stmicroelectronics.txt,"This report outlines the sustainability strategy programs and we value feedback and encourage performance of stmicroelectronics st during the course of 2022-2023. The report includes detailed information on innovations, cost effectiveness, technology, innovation, and growth in the field of semiconductors. In addition, the report predicts that 2023 will be the peak year for this industry. summarize: dell'inquinamento per quanto riguarda l'uso e la presenza di sostanze chimiche ha portato all'identificazione di linee di prodotto, which is a valutazione del rischio climatico e della vulnerabilità. questo criterio dnsh è stato completato una livello di produzione, i.e. una valutation del rifiuto e.g. organizione osmographie, tecnologie, licenziata,",2
Prysmian.txt,"Pirelli presents its strategy for the 2023 Paris climate change summit, which will determine the size of the market and how it will be managed. It also includes a detailed analysis of the social and economic effects of this summit as well as an assessment of the growth opportunities in the next few years. The report anticipates significant growth over the next several years due to rapid innovation and new technology. Prysmian organizes its annual sustainability week in London. The company plans to offer training courses for all skillful IT workers in order to improve compliance with anti-fraud regulations. Next, Pirelli details his strategy for achieving this goal: ""It will have a strong presence in all aspects of the cable industry from the point of view of distribution to the customer. It will also be able to offer reliable and cost-effective service to customers who do not want to pay shipping costs. In addition, it plans to introduce new technology that will enable it to compete with other players in the",0
Recordati_Ord.txt,"summarize: In this chapter, Gulliver discusses the growth of the biotechnology industry and its role in driving innovation. Dr. Barlow explains how she plans to organize ""the largest and most successful research project ever undertaken on rare diseases of pharmaceutical companies."" She will conduct it in three stages: 1) A public awareness campaign; 2) A private health insurance company; 3) An international trade association; and 4) A government agency for rare disease therapeutics. In order to advance her goal of leading a world-class research enterprise, Bauer and Co. define the scope of the project. Bauer plans to spend $1.6 billion over the next five years developing new technology for medical devices as well as other innovations such as artificial intelligence (AI), machine learning, and machine translation. Dorothee lays out details of the culture ambassador program, which will consist of 100,000 people who will serve as ambassadors for different types of health-related products and services. The report",0
Telecom_italia.txt,"summarize: summarize: bilancio 2023 dichiarazione consolidata 2023 1st class ambiente social governance gri tassonomia lettera, stakeholders tim. 2016 tim. 823 2nd class SDG2023 The following year, the group plans to invest $1.6 billion in research and development over the next five years. This will be the largest investment ever made in a single company. In addition, it plans to spend about $2.5 billion on infrastructure projects by 2023. By the end of the decade, the project will have costed more than $3.7 billion. With this in mind, we look forward to seeing what the future holds for these companies. summarize.com predicts that 2023 will be ""the peak of social governance"" i.e. people-satisfied by a combination of rapid innovation, cost effectiveness, and performance management. It also organizes a series of conferences and workshops throughout the 2023",2
Gruppo_Generali.txt,"summarize: This is the most important issue of the year, and it sets the tone for the rest of the report. It lays out the strategies that will be used to advance the growth of the bioprocessor industry over the next several years. For example, Volger and Co. plan to launch Carbonio in 2023, which will enable them to scale back their reliance on coal-fired electricity generation by the end of the century. The company expects to have revenue of $1.6 billion by 2040 driven primarily by China's energy and transport industries. Bauer explains how Bauer & Co. plans to pay more for asset management and wealth management than it spends on research and development. Gulliver outlines the scope of his strategy for driving innovation and growth in the 21st century. He focuses on three areas: 1) developing a technology that enables companies to scale up production; 2) improving customer loyalty; and 3) creating an environment where people are more likely",2
Tenaris.txt,"summarize: The Global Compact, a set of voluntary accoutrements designed to improve the efficiency and competitiveness of the energy industry in developing countries, states that ""the value of this compact"" will increase over the next several years. The report details performance indicators for the 2023 and 2023 years as well as a forecast for the rest of the year. In addition, the report foresees an increase in the number of people employed by the end of the decade.",2
Bper_Banca.txt,"summarize: The british bank, the largest in the world, is preparing a detailed report of its financial position for the 2023-2023 period. It plans to invest about $10 billion in infrastructure projects over the next few years as part of an effort to diversify its market share and introduce ""fusione"" financing that will enable it to support growth in emerging markets. Gulliver explains how he came to be a part of the largest bank by assets, which includes Banca dell'Espagne, Italy's second-largest bank; Gruppo Bercovici organizes a meeting of the executive board of directors of the Bank of England in London. In this chapter, we delve deeper into the details of the bank's financial transactions and how they relate to each other. We also learn more about the growth of the oil and gas industry in the United States from the beginning of the 20th century until the end of the 21st century.",3
Erg.txt,"summarize: In this paper, Green Energy prepares to enter into a long-term partnership with renewable energy companies in 2023. In order to advance its strategy, it plans to invest $1.6 billion in research and development over the next five years. It also plans to introduce new technology that will enable it to compete effectively with other energy players in emerging markets. This paper focuses on three themes: climate change, energy efficiency, and planet engagement people governance. The technical details of Renewable Energy and its applications for financing are published in the next edition of this paper. Engagement people governance icatori dati 74/2021.",1
Finecobank.txt,"summarize: Finecobank, the world's largest bank by market value, announces its intention to invest $10 billion in infrastructure projects over the next five years. The company plans to spend about a third of that amount on research and development. It is also expected to announce an additional $1.5 billion in investments in the coming years. In addition, it plans to hire 1,000 people across the country during the first half of the 2023 financial year. This will be the largest investment ever made in a single bank.",3
Banca_MEDIOLANUM.txt,"summarize: Gruppo Mediolanum 2023 is the second most important development in the bank's strategy. It anticipates rapid growth, especially in the areas of innovation and social responsibility. In addition, it plans to spend $1.6 billion on research and development over the next five years. The bulk of this spending will be devoted to developing innovative financial solutions that will enable the bank to better serve its clients' interests. Gulliver discusses the growth of the middle class and how it will compete with the rise of technology in the 21st century. Commerzbank estimates that this will be the largest single-year increase in revenue since the end of the Franco-Prussian War. He describes the growth prospects for the industry in terms of innovation & scale. He focuses on innovations that enable companies to better manage their cash flow while simultaneously enriching their bottom lines. He includes details about the gruppo gri, a labor movement that has grown rapidly in popularity in recent",3
Enel.txt,"summarize: Volkswagen starts production of its electric vehicle in Germany in mid-2023. The company plans to spend $1.6 billion on electrification over the next five years. Gulliver describes the technical details of Rilevanza, its technology, and how it will be used in the future. He discusses the importance of ""stakeholder-owned enterprises; market forces; and a commitment to deliver reliable, cost-effective, and efficient R&D on behalf of each enterprise."" Volger outlines his strategy for achieving his goals. He plans to invest about $10 billion in energy efficiency projects by 2023. In this chapter, we learn more about Capitola's investments in renewable energy technology, including carbon capture and storage (CC&E) technology. We also learn that Ology plans to launch a new medical device called ""Gri esrs giusta,"" which will revolutionize the way we think about energy efficiency in the 21st",1
Campari-group.txt,"summarize: Next up for Dr. Barlow is a new addition to the crew -- this time as an aerial walker. She's going to be able to track down and kill any stray dogs that try to sneak up on her while she's out boating. Alek explains how he came to be a part of the Ford Motor Company, then describes his process of making gingerbread. Caius Martius also serves as the head of the gruppo campari in 2023. He was appointed by the Comintern as its emissary and is responsible for supervising all aspects of the organization's activities from design to construction until his retirement in 2040. The next day, the U.S. Department of Energy publishes its annual report on climate change and predicts that temperatures will rise in the second half of the century. Meanwhile, the Air Force continues to threaten North American",0
